{
  "$schema": "../../buaflow/schemas/evidence-bundle.schema.json",
  "schemaVersion": "1.0",
  "project": "expo-fastapi-postgres-sync",
  "commit": "483d12900f54aeffd437dece267d7763f7efb001",
  "generatedAt": "2026-09-23T04:44:49.809Z",
  "readinessManifestPath": "docs/evidence/readiness.json",
  "reportIndexPath": "docs/evidence/bundle-index.md",
  "toolVersions": {
    "node": "v24.12.0",
    "platform": "win32",
    "arch": "x64"
  },
  "summary": {
    "level": "R3",
    "ok": true,
    "passed": 25,
    "required": 25
  }
}
