{
  "$schema": "../../buaflow/schemas/evidence-bundle.schema.json",
  "schemaVersion": "1.0",
  "project": "nextjs-postgres-crud",
  "commit": "ef0a5d196032c56478659deeb03c15512fdfc41a",
  "generatedAt": "2026-09-23T06:59:21.277Z",
  "readinessManifestPath": "docs/evidence/readiness.json",
  "reportIndexPath": "docs/evidence/bundle-index.md",
  "toolVersions": {
    "node": "v24.12.0",
    "platform": "win32",
    "arch": "x64"
  },
  "summary": {
    "level": "R3",
    "ok": true,
    "passed": 25,
    "required": 25
  }
}
