{
  "$schema": "../../buaflow/schemas/evidence-bundle.schema.json",
  "schemaVersion": "1.0",
  "project": "fixture-project",
  "commit": "abc1234",
  "generatedAt": "2026-09-23T00:00:00.000Z",
  "readinessManifestPath": "docs/evidence/readiness.json",
  "reportIndexPath": "docs/evidence/bundle-index.md",
  "toolVersions": { "node": "v22.0.0", "platform": "linux", "arch": "x64" },
  "summary": { "level": "R3", "ok": true, "passed": 25, "required": 25 }
}
