{
  "$schema": "../../buaflow/schemas/evidence-bundle.schema.json",
  "schemaVersion": "1.0",
  "project": "react-fastapi-postgres-crud",
  "commit": "0867902176e09cbc43159d5076723f39969c3faa",
  "generatedAt": "2026-09-23T06:59:21.334Z",
  "readinessManifestPath": "docs/evidence/readiness.json",
  "reportIndexPath": "docs/evidence/bundle-index.md",
  "toolVersions": {
    "node": "v24.12.0",
    "platform": "win32",
    "arch": "x64"
  },
  "summary": {
    "level": "R3",
    "ok": true,
    "passed": 25,
    "required": 25
  }
}
